Sheet: overview
A1: MODEL SPECIES | D1: state variables in the model; part of them are component totals
A2: SLOW REACTION SPECIES | D2: the kinetic reactions are formulated for these species + solids
A3: FULL SPECIATION | D3: concentration of these species is result of solving the tableau
A7: lambda | B7: 0.6
A8: a | B8: 1
A9: b | B9: of:=16/106 -> 0.150943396226415
A10: c | B10: of:=1/106 -> 0.00943396226415094
D13: TOT_H | E13: DIC | F13: TOT_P | G13: TOT_NO3 | H13: TOT_N(-III) | I13: TOT_SO4 | J13: TOT_S(-II) | M13: CH4 | N13: O2 | O13: N2 | P13: Mn2 | Q13: Fe2 | R13: Ca2 | T13: MnO2 | U13: (CH2O)_a(NH3)_b(H3PO4)_c | V13: Fe(OH)_3 | W13: Fe(OH)_3(H3PO4)_lambda | X13: FeCO3 | Y13: S0 | Z13: FeS | AA13: Viv | AB13: CaCO3
C14: H2O | D14: H | E14: H2CO3 | F14: H2PO4 | G14: NO3 | H14: NH4 | I14: SO4 | J14: H2S | K14: logK | M14: CH4 | N14: O2 | O14: N2 | P14: Mn2 | Q14: Fe2 | R14: Ca2+
B15: H2O | C15: 1 | K15: 0
B16: H | D16: 1 | K16: 0
B17: OH | C17: 1 | D17: -1 | K17: -8
B18: H2CO3 | E18: 1 | K18: 0
B19: HCO3 | D19: -1 | E19: 1 | K19: -3.35
B20: CO3 | D20: -2 | E20: 1 | K20: -10.68
B21: H3PO4 | D21: 1 | F21: 1 | K21: -0.84
B22: H2PO4 | F22: 1 | K22: 0
B23: HPO4 | D23: -1 | F23: 1 | K23: -4.21
B24: PO4 | D24: -2 | F24: 1 | K24: -13.53
B25: HNO3 | D25: 1 | G25: 1 | K25: -4.37
B26: NO3 | G26: 1 | K26: 0
B27: NH4 | H27: 1 | K27: 0
B28: NH3 | D28: -1 | H28: 1 | K28: -6.25
B29: H2SO4 | D29: 2 | I29: 1 | K29: -7.1
B30: HSO4 | D30: 1 | I30: 1 | K30: -1.1
B31: SO4 | I31: 1 | K31: 0
B32: H2S | J32: 1 | K32: 0
B33: HS | D33: -1 | J33: 1 | K33: -4
B34: S(2-) | D34: -2 | J34: 1 | K34: -15
B36: O2 | N36: 1
B37: CO2 | C37: -1 | E37: 1
B38: NH3 | D38: -1 | H38: 1
B39: H3PO4 | D39: 1 | F39: 1
B40: HNO3 | D40: 1 | G40: 1
B41: N2 | O41: 1
B42: Fe(OH)2 | C42: 2 | D42: -2 | Q42: 1
B43: Mn(OH)2 | C43: 2 | D43: -2 | P43: 1
B44: H2SO4 | D44: 2 | I44: 1
B45: H2S | J45: 1
B46: CH4 | M46: 1
B47: H2CO3 | E47: 1
B48: Ca(OH)2 | C48: 2 | D48: -2 | R48: 1

Sheet: logKs
E3: Species | F3: logK (old) | G3: K | H3: logK
E4: H2O | F4: 0 | G4: 1 | H4: of:=LOG10([.G4]) -> 0
E5: H | F5: 0 | G5: 1 | H5: of:=LOG10([.G5]) -> 0
E6: OH | F6: -14.0039263455147 | G6: of:=10^-14*10^6 -> 0.00000001 | H6: of:=LOG10([.G6]) -> -8
E7: H2CO3 | F7: 0 | G7: 1 | H7: of:=LOG10([.G7]) -> 0
E8: HCO3 | F8: -6.35261702988538 | G8: of:=10^-6.35*10^3 -> 0.000446683592150964 | H8: of:=LOG10([.G8]) -> -3.35
E9: CO3 | F9: -16.6833001493193 | G9: of:=10^-6.35*10^3*10^-10.33*10^3 -> 0.00000000002089296131 | H9: of:=LOG10([.G9]) -> -10.68
E10: H3PO4 | F10: 2.16 | G10: of:=1/(10^-2.16*10^3) -> 0.144543977074593 | H10: of:=LOG10([.G10]) -> -0.84
E11: H2PO4 | F11: 0 | G11: 1 | H11: of:=LOG10([.G11]) -> 0
E12: HPO4 | F12: -7.26 | G12: of:=10^-7.21*10^3 -> 0.0000616595001861482 | H12: of:=LOG10([.G12]) -> -4.21
E13: PO4 | F13: -19.53 | G13: of:=10^-7.21*10^3*10^-12.32*10^3 -> 0.00000000000002951209 | H13: of:=LOG10([.G13]) -> -13.53
E14: HNO3 | F14: -1.37 | G14: of:=1/(10^1.37*10^3) -> 0.0000426579518801593 | H14: of:=LOG10([.G14]) -> -4.37
E15: NO3 | F15: 0 | G15: 1 | H15: of:=LOG10([.G15]) -> 0
E16: NH4 | F16: 0 | G16: 1 | H16: of:=LOG10([.G16]) -> 0
E17: NH3 | F17: -9.25 | G17: of:=10^-9.25*10^3 -> 0.00000056234132519035 | H17: of:=LOG10([.G17]) -> -6.25
E18: H2SO4 | F18: 1.1 | G18: of:=1/(10^3*10^3*10^-1.9*10^3) -> 0.00000007943282347243 | H18: of:=LOG10([.G18]) -> -7.1
E19: HSO4 | F19: 1.9 | G19: of:=1/(10^-1.9*10^3) -> 0.0794328234724281 | H19: of:=LOG10([.G19]) -> -1.1
E20: SO4 | F20: 0 | G20: 1 | H20: of:=LOG10([.G20]) -> 0
E21: H2S | F21: 0 | G21: 1 | H21: of:=LOG10([.G21]) -> 0
E22: HS | F22: -7 | G22: of:=10^-7*10^3 -> 0.0001 | H22: of:=LOG10([.G22]) -> -4
E23: S(2-) | F23: -21 | G23: of:=10^-7*10^3*10^-14*10^3 -> 1E-015 | H23: of:=LOG10([.G23]) -> -15

Sheet: translation_table
A1: Species | B1: H | C1: H2CO3 | D1: H2PO4 | E1: NO3 | F1: NH4 | G1: SO4 | H1: H2S | I1: CH4 | J1: O2 | K1: N2 | L1: Mn2 | M1: Fe2
A2: O2 | J2: 1
A3: CO2 | C3: 1
A4: NH3 | B4: -1 | F4: 1
A5: H3PO4 | B5: 1 | D5: 1
A6: HNO3 | B6: 1 | E6: 1
A7: N2 | K7: 1
A8: Fe(OH)2 | B8: -2 | M8: 1
A9: Mn(OH)2 | B9: -2 | L9: 1
A10: H2SO4 | B10: 2 | G10: 1
A11: H2S | H11: 1
A12: CH4 | I12: 1

Sheet: morel_tableau
A1: Species | B1: H2O | C1: H | D1: H2CO3 | E1: H2PO4 | F1: NO3 | G1: NH4 | H1: SO4 | I1: H2S | J1: logK
A2: H2O | B2: 1 | J2: 0
A3: H | C3: 1 | J3: 0
A4: OH | B4: 1 | C4: -1 | J4: -8
A5: H2CO3 | D5: 1 | J5: 0
A6: HCO3 | C6: -1 | D6: 1 | J6: -3.35
A7: CO3 | C7: -2 | D7: 1 | J7: -10.68
A8: H3PO4 | C8: 1 | E8: 1 | J8: -0.84
A9: H2PO4 | E9: 1 | J9: 0
A10: HPO4 | C10: -1 | E10: 1 | J10: -4.21
A11: PO4 | C11: -2 | E11: 1 | J11: -13.53
A12: HNO3 | C12: 1 | F12: 1 | J12: -4.37
A13: NO3 | F13: 1 | J13: 0
A14: NH4 | G14: 1 | J14: 0
A15: NH3 | C15: -1 | G15: 1 | J15: -6.25
A16: H2SO4 | C16: 2 | H16: 1 | J16: -7.1
A17: HSO4 | C17: 1 | H17: 1 | J17: -1.1
A18: SO4 | H18: 1 | J18: 0
A19: H2S | I19: 1 | J19: 0
A20: HS | C20: -1 | I20: 1 | J20: -4
A21: S2 | C21: -2 | I21: 1 | J21: -15